{
  "schema": "run-state.v1",
  "run_id": "run_01JB2C3D4E5F6G7H8J9KMNPQ05",
  "rev": 4,
  "workflow": "brownfield-change@1.3.0",
  "ticket": "ABC-555",
  "system": "SYS-SUP",
  "owner": "key_01JC3D4E5F6G7H8J9KMNPQRSTV",
  "owner_pseudonym": "eng-4f2a",
  "status": "COMPLETED",
  "end_reason": "completed",
  "pinned": {
    "plugin": "0.1.0",
    "tsl": "0.1.0",
    "skills": {
      "requirement-review": "1.0.0"
    }
  },
  "pack": {
    "signed_at": "2026-01-01T09:00:00Z",
    "fresh": true,
    "source_sha": {
      "sample-orders": "6acd621280932e6f3f2f8783e06992590b6c7a53"
    }
  },
  "branch": {},
  "cursor": null,
  "steps": [
    {
      "id": "req",
      "kind": "skill",
      "status": "DONE",
      "budget_used": {
        "checks": 0,
        "review": 0,
        "verifier": 0,
        "rework": 0
      },
      "attempts": [
        {
          "n": 1,
          "cause": "first",
          "skill": "requirement-review@1.0.0",
          "outcome": "PASS",
          "band": "High"
        }
      ]
    }
  ],
  "gates": [],
  "questions": {
    "round": 0,
    "open_blocking": 0,
    "open_non_blocking": 0,
    "answered_sha256": {}
  },
  "prs": [],
  "created_at": "2026-01-05T09:58:00Z",
  "updated_at": "2026-01-06T10:20:00Z",
  "heartbeat_at": "2026-01-06T10:20:00Z"
}
